{
  "schema": "music-studies/performance-rig/v1",
  "kind": "hardware-preset",
  "id": "arturia-pad-switches",
  "display_name": "Arturia Pad Switches",
  "description": "Arturia controls plus the verified Bank A/B management pad note matrix; candidate management layer only.",
  "device_models": [
    "KeyLab Essential 61 mk3"
  ],
  "verification": {
    "status": "verified",
    "source_refs": [
      "protected-setup.controller-profile.arturia",
      "stable-helper.arturia-main-volume-encoder",
      "arturia-pad-capture-2026-09-12"
    ]
  },
  "controls": [
    {"id":"arturia-pad-a-1","physical_control":"Pad 1 Bank A","behavior":"momentary","message":{"type":"note","channel":10,"number":40,"edge":"press"},"off_value":0,"on_value":127},
    {"id":"arturia-pad-a-2","physical_control":"Pad 2 Bank A","behavior":"momentary","message":{"type":"note","channel":10,"number":41,"edge":"press"},"off_value":0,"on_value":127},
    {"id":"arturia-pad-a-3","physical_control":"Pad 3 Bank A","behavior":"momentary","message":{"type":"note","channel":10,"number":42,"edge":"press"},"off_value":0,"on_value":127},
    {"id":"arturia-pad-a-4","physical_control":"Pad 4 Bank A","behavior":"momentary","message":{"type":"note","channel":10,"number":43,"edge":"press"},"off_value":0,"on_value":127},
    {"id":"arturia-pad-a-5","physical_control":"Pad 5 Bank A","behavior":"momentary","message":{"type":"note","channel":10,"number":36,"edge":"press"},"off_value":0,"on_value":127},
    {"id":"arturia-pad-a-6","physical_control":"Pad 6 Bank A","behavior":"momentary","message":{"type":"note","channel":10,"number":37,"edge":"press"},"off_value":0,"on_value":127},
    {"id":"arturia-pad-a-7","physical_control":"Pad 7 Bank A","behavior":"momentary","message":{"type":"note","channel":10,"number":38,"edge":"press"},"off_value":0,"on_value":127},
    {"id":"arturia-pad-a-8","physical_control":"Pad 8 Bank A","behavior":"momentary","message":{"type":"note","channel":10,"number":39,"edge":"press"},"off_value":0,"on_value":127},
    {"id":"arturia-pad-b-1","physical_control":"Pad 1 Bank B","behavior":"momentary","message":{"type":"note","channel":10,"number":48,"edge":"press"},"off_value":0,"on_value":127},
    {"id":"arturia-pad-b-2","physical_control":"Pad 2 Bank B","behavior":"momentary","message":{"type":"note","channel":10,"number":49,"edge":"press"},"off_value":0,"on_value":127},
    {"id":"arturia-pad-b-3","physical_control":"Pad 3 Bank B","behavior":"momentary","message":{"type":"note","channel":10,"number":50,"edge":"press"},"off_value":0,"on_value":127},
    {"id":"arturia-pad-b-4","physical_control":"Pad 4 Bank B","behavior":"momentary","message":{"type":"note","channel":10,"number":51,"edge":"press"},"off_value":0,"on_value":127},
    {"id":"arturia-pad-b-5","physical_control":"Pad 5 Bank B","behavior":"momentary","message":{"type":"note","channel":10,"number":44,"edge":"press"},"off_value":0,"on_value":127},
    {"id":"arturia-pad-b-6","physical_control":"Pad 6 Bank B","behavior":"momentary","message":{"type":"note","channel":10,"number":45,"edge":"press"},"off_value":0,"on_value":127},
    {"id":"arturia-pad-b-7","physical_control":"Pad 7 Bank B","behavior":"momentary","message":{"type":"note","channel":10,"number":46,"edge":"press"},"off_value":0,"on_value":127},
    {"id":"arturia-pad-b-8","physical_control":"Pad 8 Bank B","behavior":"momentary","message":{"type":"note","channel":10,"number":47,"edge":"press"},"off_value":0,"on_value":127},
    {
      "id": "fader-1",
      "physical_control": "Fader 1",
      "behavior": "absolute",
      "message": {
        "type": "cc",
        "channel": 1,
        "number": 73,
        "edge": "change"
      }
    },
    {
      "id": "fader-2",
      "physical_control": "Fader 2",
      "behavior": "absolute",
      "message": {
        "type": "cc",
        "channel": 1,
        "number": 75,
        "edge": "change"
      }
    },
    {
      "id": "fader-3",
      "physical_control": "Fader 3",
      "behavior": "absolute",
      "message": {
        "type": "cc",
        "channel": 1,
        "number": 79,
        "edge": "change"
      }
    },
    {
      "id": "fader-4",
      "physical_control": "Fader 4",
      "behavior": "absolute",
      "message": {
        "type": "cc",
        "channel": 1,
        "number": 72,
        "edge": "change"
      }
    },
    {
      "id": "fader-5",
      "physical_control": "Fader 5",
      "behavior": "absolute",
      "message": {
        "type": "cc",
        "channel": 1,
        "number": 80,
        "edge": "change"
      }
    },
    {
      "id": "fader-6",
      "physical_control": "Fader 6",
      "behavior": "absolute",
      "message": {
        "type": "cc",
        "channel": 1,
        "number": 81,
        "edge": "change"
      }
    },
    {
      "id": "fader-7",
      "physical_control": "Fader 7",
      "behavior": "absolute",
      "message": {
        "type": "cc",
        "channel": 1,
        "number": 82,
        "edge": "change"
      }
    },
    {
      "id": "fader-8",
      "physical_control": "Fader 8",
      "behavior": "absolute",
      "message": {
        "type": "cc",
        "channel": 1,
        "number": 83,
        "edge": "change"
      }
    },
    {
      "id": "fader-9",
      "physical_control": "Fader 9",
      "behavior": "absolute",
      "message": {
        "type": "cc",
        "channel": 1,
        "number": 85,
        "edge": "change"
      }
    },
    {
      "id": "knob-1",
      "physical_control": "Knob 1",
      "behavior": "absolute",
      "message": {
        "type": "cc",
        "channel": 1,
        "number": 74,
        "edge": "change"
      }
    },
    {
      "id": "knob-2",
      "physical_control": "Knob 2",
      "behavior": "absolute",
      "message": {
        "type": "cc",
        "channel": 1,
        "number": 71,
        "edge": "change"
      }
    },
    {
      "id": "knob-3",
      "physical_control": "Knob 3",
      "behavior": "absolute",
      "message": {
        "type": "cc",
        "channel": 1,
        "number": 76,
        "edge": "change"
      }
    },
    {
      "id": "knob-4",
      "physical_control": "Knob 4",
      "behavior": "absolute",
      "message": {
        "type": "cc",
        "channel": 1,
        "number": 77,
        "edge": "change"
      }
    },
    {
      "id": "knob-5",
      "physical_control": "Knob 5",
      "behavior": "absolute",
      "message": {
        "type": "cc",
        "channel": 1,
        "number": 93,
        "edge": "change"
      }
    },
    {
      "id": "knob-6",
      "physical_control": "Knob 6",
      "behavior": "absolute",
      "message": {
        "type": "cc",
        "channel": 1,
        "number": 18,
        "edge": "change"
      }
    },
    {
      "id": "knob-7",
      "physical_control": "Knob 7",
      "behavior": "absolute",
      "message": {
        "type": "cc",
        "channel": 1,
        "number": 19,
        "edge": "change"
      }
    },
    {
      "id": "knob-8",
      "physical_control": "Knob 8",
      "behavior": "absolute",
      "message": {
        "type": "cc",
        "channel": 1,
        "number": 16,
        "edge": "change"
      }
    },
    {
      "id": "knob-9",
      "physical_control": "Knob 9",
      "behavior": "absolute",
      "message": {
        "type": "cc",
        "channel": 1,
        "number": 17,
        "edge": "change"
      }
    },
    {
      "id": "central-encoder",
      "physical_control": "Central encoder",
      "behavior": "relative",
      "message": {
        "type": "cc",
        "channel": 1,
        "number": 114,
        "edge": "change"
      },
      "relative_encoding": "binary-offset"
    },
    {
      "id": "central-click",
      "physical_control": "Central encoder click",
      "behavior": "momentary",
      "message": {
        "type": "cc",
        "channel": 1,
        "number": 115,
        "edge": "any"
      },
      "off_value": 0,
      "on_value": 127
    }
  ]
}
