{
  "schema": "music-studies/performance-rig/v1",
  "kind": "hardware-preset",
  "id": "fixture-preset",
  "display_name": "Fixture Preset",
  "device_models": [
    "Fixture Controller Model"
  ],
  "verification": {
    "status": "verified",
    "source_refs": [
      "fixture.observation"
    ]
  },
  "preset_slot": "User 1",
  "configuration_tool": "Fixture Editor",
  "internal_controls": [
    {
      "id": "bank-next",
      "physical_control": "Bank Next",
      "behavior": "momentary",
      "action": "device.bank-next"
    }
  ],
  "controls": [
    {
      "id": "fader-1",
      "physical_control": "Fader 1",
      "behavior": "absolute",
      "message": {
        "type": "cc",
        "channel": 1,
        "number": 20,
        "edge": "change"
      }
    },
    {
      "id": "management-pad",
      "physical_control": "Management Pad",
      "behavior": "momentary",
      "message": {
        "type": "note",
        "channel": 16,
        "number": 36,
        "edge": "any"
      }
    }
  ]
}
